{
  "documentType": "clover-federated-portfolio-registry",
  "schemaVersion": "2.0.0",
  "status": "candidate-unmerged-undeployed",
  "updatedAt": "2026-08-20T02:48:13-05:00",
  "timezone": "America/Chicago",
  "sourceBasis": [
    {
      "sourceId": "portfolio/registry/projects.json",
      "sourceType": "git-bytes",
      "status": "verified",
      "observedAt": "2026-08-20T02:48:13-05:00",
      "contentHash": "2aeb1d6ec42e89d95c6c78180242b78818d2274bf5c5f2f0e1d0fedccdab1821",
      "limitations": ["The preserved 1.0 registry is a historical planning snapshot and is not a complete live-source reconciliation."]
    },
    {
      "sourceId": "audit:clover-portfolio-core-integration:2026-08-20",
      "sourceType": "owner-provided-audit",
      "status": "partially-verified",
      "observedAt": "2026-08-20T02:13:22-05:00",
      "contentHash": "c02d29ab01d7fa3aa8c9917d060ee0178c45b9a73639c378b775177280afda0d",
      "limitations": ["The audit did not have a complete current OpenAI Sites management inventory.", "Short Git and deployment prefixes are not promoted to exact commit or deployment identities."]
    },
    {
      "sourceId": "github-repository-readback-2026-08-20",
      "sourceType": "repository-readback",
      "status": "verified",
      "observedAt": "2026-08-20T02:48:13-05:00",
      "contentHash": null,
      "limitations": ["Repository existence does not prove deployment or product release state."]
    },
    {
      "sourceId": "vercel-team-readback-2026-08-20",
      "sourceType": "deployment-readback",
      "status": "partially-verified",
      "observedAt": "2026-08-20T02:48:13-05:00",
      "contentHash": null,
      "limitations": ["Ten team projects were visible, but several source identities were available only as short prefixes and the Gateway preview exposed no Git SHA metadata."]
    },
    {
      "sourceId": "cloverapps-sites80-source-receipt-2026-08-20",
      "sourceType": "sites-receipt",
      "status": "verified",
      "observedAt": "2026-08-20T02:48:13-05:00",
      "contentHash": "a1aa1db89d6647457a6072109af3be6a72724dbc018cf30194d09fab6366d299",
      "limitations": ["Sites version 80 is a saved source checkpoint and was not deployed."]
    }
  ],
  "architecture": {
    "pattern": "federated-kernel-sovereign-cells",
    "kernelProjectId": "clover-core",
    "ownerWindowProjectId": "cloverapps-ai",
    "contextGatewayProjectId": "clover-context-gateway",
    "knowledgeSubsystemProjectId": "knowledge-hub-window-vault",
    "principles": [
      "One governed intelligence, many sovereign stores, minimum necessary context.",
      "Core records identity, provenance, policy, authority, and receipts rather than absorbing raw Cell data.",
      "Applications and external systems remain authoritative for their own operational records.",
      "Unknown, unverified, candidate, production, and historical identities remain distinct.",
      "A release, Sites save, commit, pull request, deployment, data schema, backup, verification, and rollback identity may not be collapsed into one version number."
    ]
  },
  "records": [
    {
      "projectId": "cloverapps-ai",
      "title": "CloverApps.ai",
      "classification": "application",
      "lifecycle": "active-runtime",
      "portfolioArea": "clover-control-plane",
      "architectureRole": "owner-window",
      "ownershipStatus": "owner-controlled",
      "sourceOfTruth": {"status":"verified","system":"OpenAI Sites","location":"appgprj_6a66917a5e5881919720b4c8f8b79bed","rawCellDataStoredInCore":false},
      "coreProjection": {"allowed":["portfolio identity, priorities, approvals, versions, receipts, and next actions"],"excluded":["raw legal evidence, customer records, credentials, private conversations, and Cell runtime data"]},
      "relationships": [{"type":"owner-window-for","targetProjectId":"clover-core","status":"verified"}],
      "versionIdentities": [
        {
          "identityId": "live-7.4.2",
          "role": "production",
          "release": {"status":"verified","value":"7.4.2","evidenceRefs":["cloverapps-sites80-source-receipt-2026-08-20"]},
          "sitesSave": {"status":"verified","value":79,"evidenceRefs":["cloverapps-sites80-source-receipt-2026-08-20"]},
          "commit": {"status":"unknown","value":null,"evidenceRefs":[]},
          "pullRequest": {"status":"not-applicable","value":null,"evidenceRefs":[]},
          "deployment": {"status":"verified","value":"https://cloverapps.ai","provider":"OpenAI Sites","environment":"production","evidenceRefs":["cloverapps-sites80-source-receipt-2026-08-20"]},
          "dataSchema": {"status":"unknown","value":null,"evidenceRefs":[]},
          "backup": {"status":"unknown","value":null,"evidenceRefs":[]},
          "verification": {"status":"verified","value":"live source baseline read back before Sites80 save","observedAt":"2026-08-20T02:48:13-05:00","evidenceRefs":["cloverapps-sites80-source-receipt-2026-08-20"]},
          "rollback": {"status":"unknown","value":null,"evidenceRefs":[]}
        },
        {
          "identityId": "sites80-source-checkpoint",
          "role": "source-checkpoint",
          "release": {"status":"candidate-unvalidated","value":"7.4.3 source-candidate checkpoint based on live 7.4.2","evidenceRefs":["cloverapps-sites80-source-receipt-2026-08-20"]},
          "sitesSave": {"status":"verified","value":80,"evidenceRefs":["cloverapps-sites80-source-receipt-2026-08-20"]},
          "commit": {"status":"verified","value":"b7f6bf19d410cfbbc080bdd58f35fd6881535e38","repository":"CloverApps Sites source repository","branch":"main","evidenceRefs":["cloverapps-sites80-source-receipt-2026-08-20"]},
          "pullRequest": {"status":"not-applicable","value":null,"evidenceRefs":[]},
          "deployment": {"status":"not-applicable","value":null,"notes":"The saved source checkpoint was not deployed.","evidenceRefs":["cloverapps-sites80-source-receipt-2026-08-20"]},
          "dataSchema": {"status":"unknown","value":null,"evidenceRefs":[]},
          "backup": {"status":"partially-verified","value":"Sites archive content sha256:a1aa1db89d6647457a6072109af3be6a72724dbc018cf30194d09fab6366d299","evidenceRefs":["cloverapps-sites80-source-receipt-2026-08-20"]},
          "verification": {"status":"verified","value":"331 tests plus independent focused review","observedAt":"2026-08-20T02:48:13-05:00","evidenceRefs":["cloverapps-sites80-source-receipt-2026-08-20"]},
          "rollback": {"status":"unknown","value":null,"evidenceRefs":[]}
        }
      ],
      "verificationStatus": "partially-verified",
      "statusNotes": ["CloverApps is the owner-facing window, not the Core database.", "Sites80 is saved source only and does not replace the live 7.4.2 identity."],
      "unknowns": ["Exact live source commit", "Data-schema identity", "Restore-tested backup and rollback anchor"],
      "nextMilestone": "Consume the candidate Core projection without treating Sites80 as deployed."
    },
    {
      "projectId": "clover-core",
      "title": "Clover Core",
      "classification": "infrastructure",
      "lifecycle": "active-candidate",
      "portfolioArea": "clover-control-plane",
      "architectureRole": "kernel",
      "ownershipStatus": "owner-controlled",
      "sourceOfTruth": {"status":"verified","system":"GitHub","location":"chrisdortch/first","rawCellDataStoredInCore":false},
      "coreProjection": {"allowed":["identity, provenance, effective dates, policy, authority, priorities, and receipts"],"excluded":["raw legal, financial, health, guest, staff, credential, and application records"]},
      "relationships": [],
      "versionIdentities": [
        {
          "identityId":"pr15-core-0.1-candidate","role":"candidate",
          "release":{"status":"candidate-unvalidated","value":"Core architecture candidate 0.1","evidenceRefs":["github-repository-readback-2026-08-20"]},
          "sitesSave":{"status":"unknown","value":null,"evidenceRefs":[]},
          "commit":{"status":"verified","value":"05dd1c8c4e14d8133bb78490f8108f6b3c62f518","repository":"chrisdortch/first","branch":"platform/clover-context-gateway-core-today-20260818","evidenceRefs":["github-repository-readback-2026-08-20"]},
          "pullRequest":{"status":"verified","value":"chrisdortch/first#15","evidenceRefs":["github-repository-readback-2026-08-20"]},
          "deployment":{"status":"not-applicable","value":null,"notes":"PR #15 remains unmerged and undeployed.","evidenceRefs":["github-repository-readback-2026-08-20"]},
          "dataSchema":{"status":"candidate-unvalidated","value":"Core schema candidate 0.2 additions","evidenceRefs":["github-repository-readback-2026-08-20"]},
          "backup":{"status":"unknown","value":null,"evidenceRefs":[]},
          "verification":{"status":"verified","value":"deterministic Core tests passed locally","evidenceRefs":["github-repository-readback-2026-08-20"]},
          "rollback":{"status":"verified","value":"be62b3d8dfb07eecb52628f1b629fd308eb3cb24","evidenceRefs":["github-repository-readback-2026-08-20"]}
        },
        {
          "identityId":"trust-hardening-0.2-candidate","role":"candidate",
          "release":{"status":"candidate-unvalidated","value":"Clover Core trust hardening 0.2","evidenceRefs":["github-repository-readback-2026-08-20"]},
          "sitesSave":{"status":"not-applicable","value":null,"evidenceRefs":[]},
          "commit":{"status":"unknown","value":null,"repository":"chrisdortch/first","branch":"platform/clover-core-trust-slice-v0.2-20260818","notes":"Final candidate commit is not stable until this integration slice is committed.","evidenceRefs":["github-repository-readback-2026-08-20"]},
          "pullRequest":{"status":"unknown","value":null,"evidenceRefs":[]},
          "deployment":{"status":"not-applicable","value":null,"notes":"No deployment authorized or performed.","evidenceRefs":[]},